### ISSUE TITLE
unable to connect to traffic-manager: WatchClusterInfo recv: Unavailable: error reading from server: EOF

### ISSUE THREAD

**Issue by Loki-Afro** [telepresenceio/telepresence#3876]
**Describe the bug**
Unable to connect to cluster due to `WatchClusterInfo recv: Unavailable: error reading from server: EOF`

i'm on an existing cluster, i installed the traffic manager into the the ambassador namespace using helm
after that, i attempt to connect to a different namespace using telepresence, however that session is not being established

[telepresence_logs_2025-06-12T14:01:03+02:00.zip](https://github.com/user-attachments/files/20708742/telepresence_logs_2025-06-12T14.01.03%2B02.00.zip)

**To Reproduce**
1. When I run 
```
telepresence connect -n bc-8828 --manager-namespace ambassador --mapped-namespaces bc-882
Launching Telepresence User Daemon
Launching Telepresence Root Daemon
Connected to context ...
```
2. however shortly after i'm not connected e.g.
```
telepresence status
OSS User Daemon: Running
  Version           : 2.22.6
  Executable        : /usr/local/bin/telepresence
  Install ID        : eb0d1390-d00b-4fa3-b2d4-fe4503187fa6
  Status            : Not connected
  Kubernetes server :
  Kubernetes context:
  Namespace         :
  Manager namespace :
OSS Root Daemon: Running
  Version: v2.22.6
Traffic Manager: Not connected
```

**Versions (please complete the following information):**
 - Output of `telepresence version` (preferably while telepresence is connected)
```
telepresence version
OSS Client     : v2.22.6
OSS Root Daemon: v2.22.6
OSS User Daemon: v2.22.6
Traffic Manager: not connected (but fresh install, also 2.22.6
```
 - Operating system of workstation running `telepresence` commands
fedora 42, same issue on a freshly installed ubuntu vm
 - Kubernetes environment and Version [e.g. Minikube, bare metal, Google Kubernetes Engine]
 v1.30.7 hosted at Ionos

**Additional context**
i tried telepresence before on minikube without any issues :/

**Comment by thallgren** [comment]
You do get warnings from Kubernetes: "Use tokens from the TokenRequest API or manually created secret-based tokens instead of auto-generated secret-based tokens". I've never seen those before. Perhaps they are related to your problem here?

**Comment by Loki-Afro** [comment]
@thallgren its not related .. you get these with every kubectl command you issue with the config i have. there is no lack of feature or anything, its just annoying

https://discuss.kubernetes.io/t/kubectl-warning-use-tokens-from-the-tokenrequest-instead-of-auto-generated-secret-based-tokens/27186/5 for example

**Comment by thallgren** [comment]
Hmm, that's the only problem I can see. Can you check for events in the traffic-manager's namespace? Perhaps turn on loglevel trace and check if that reveals something?

**Comment by Loki-Afro** [comment]
hey @thallgren i didn't found any event
other than this one
```
zarathustra@esel ~/code/schulcloud-calendar (git)-[main] % kubectl --kubeconfig ~/.kube/sc-dev-dbc.yaml -n ambassador get events
LAST SEEN   TYPE      REASON                            OBJECT                                 MESSAGE
2m42s       Warning   FailedToRetrieveImagePullSecret   pod/traffic-manager-6b597486bc-w4zjc   Unable to retrieve some image pull secrets (docker-token); attempting to pull the image may not succeed
```

image gets pulled from dockerhub nevertheless.

i found this error on my local machine using `journalctl -f`, but i'm almost certain that this is being caused by the early stop of the connect command which issues a bunch of calls simultaneously i guess

```

Jun 16 10:31:55 esel systemd[1]: Started session-c38.scope - Session c38 of User root.
Jun 16 10:31:55 esel sudo[1449666]: pam_unix(sudo:session): session opened for user root(uid=0) by zarathustra(uid=1000)
Jun 16 10:31:55 esel audit[1449666]: USER_START pid=1449666 uid=1000 auid=1000 ses=1 subj=unconfined_u:unconfined_r:unconfined_t:s0-s0:c0.c1023 msg='op=PAM:session_open grantors=pam_keyinit,pam_limits,pam_keyinit,pam_limits,pam_systemd,pam_unix acct="root" exe="/usr/bin/sudo" hostname=? addr=? terminal=/dev/pts/8 res=success'
Jun 16 10:31:59 esel avahi-daemon[8112]: Joining mDNS multicast group on interface tel0.IPv6 with address fe80::f842:9fd4:4186:768f.
Jun 16 10:31:59 esel avahi-daemon[8112]: New relevant interface tel0.IPv6 for mDNS.
Jun 16 10:31:59 esel avahi-daemon[8112]: Registering new address record for fe80::f842:9fd4:4186:768f on tel0.*.
Jun 16 10:31:59 esel NetworkManager[8336]: <info>  [1750062719.6600] manager: (tel0): new Tun device (/org/freedesktop/NetworkManager/Devices/73)
Jun 16 10:31:59 esel avahi-daemon[8112]: Joining mDNS multicast group on interface tel0.IPv4 with address 10.233.0.0.
Jun 16 10:31:59 esel avahi-daemon[8112]: New relevant interface tel0.IPv4 for mDNS.
Jun 16 10:31:59 esel avahi-daemon[8112]: Registering new address record for 10.233.0.0 on tel0.IPv4.
Jun 16 10:31:59 esel avahi-daemon[8112]: Registering new address record for 10.209.0.0 on tel0.IPv4.
Jun 16 10:31:59 esel avahi-daemon[8112]: Registering new address record for 10.210.177.0 on tel0.IPv4.
Jun 16 10:31:59 esel avahi-daemon[8112]: Registering new address record for 10.211.74.0 on tel0.IPv4.
Jun 16 10:31:59 esel avahi-daemon[8112]: Registering new address record for 10.213.0.0 on tel0.IPv4.
Jun 16 10:31:59 esel avahi-daemon[8112]: Registering new address record for 10.217.252.0 on tel0.IPv4.
Jun 16 10:31:59 esel avahi-daemon[8112]: Registering new address record for 10.219.127.0 on tel0.IPv4.
Jun 16 10:31:59 esel avahi-daemon[8112]: Registering new address record for 10.220.96.0 on tel0.IPv4.
Jun 16 10:31:59 esel avahi-daemon[8112]: Registering new address record for 10.221.164.0 on tel0.IPv4.
Jun 16 10:31:59 esel avahi-daemon[8112]: Registering new address record for 85.215.128.0 on tel0.IPv4.
Jun 16 10:31:59 esel systemd-resolved[7766]: tel0: Bus client set DNS server list to: 10.213.51.9
Jun 16 10:31:59 esel systemd-resolved[7766]: tel0: Bus client set search domain list to: tel2-search, ~cluster.local.
Jun 16 10:31:59 esel dnsmasq[71879]: reading /etc/resolv.conf
Jun 16 10:31:59 esel dnsmasq[71879]: using nameserver 127.0.0.53#53
Jun 16 10:31:59 esel dnsmasq[71879]: reading /etc/resolv.conf
Jun 16 10:31:59 esel dnsmasq[71879]: using nameserver 127.0.0.53#53
Jun 16 10:31:59 esel NetworkManager[8336]: <info>  [1750062719.6731] device (tel0): state change: unmanaged -> unavailable (reason 'connection-assumed', managed-type: 'external')
Jun 16 10:31:59 esel systemd-resolved[7766]: Using degraded feature set UDP instead of UDP+EDNS0 for DNS server 10.213.51.9.
Jun 16 10:31:59 esel NetworkManager[8336]: <info>  [1750062719.6735] device (tel0): state change: unavailable -> disconnected (reason 'connection-assumed', managed-type: 'external')
Jun 16 10:31:59 esel NetworkManager[8336]: <info>  [1750062719.6741] device (tel0): Activation: starting connection 'tel0' (a80aedb0-ac52-4b74-b19b-fa2973f78df3)
Jun 16 10:31:59 esel NetworkManager[8336]: <info>  [1750062719.6751] device (tel0): state change: disconnected -> prepare (reason 'none', managed-type: 'external')
Jun 16 10:31:59 esel NetworkManager[8336]: <info>  [1750062719.6753] device (tel0): state change: prepare -> config (reason 'none', managed-type: 'external')
Jun 16 10:31:59 esel NetworkManager[8336]: <info>  [1750062719.6754] device (tel0): state change: config -> ip-config (reason 'none', managed-type: 'external')
Jun 16 10:31:59 esel NetworkManager[8336]: <info>  [1750062719.6756] device (tel0): state change: ip-config -> ip-check (reason 'none', managed-type: 'external')
Jun 16 10:31:59 esel dnsmasq[71879]: reading /etc/resolv.conf
Jun 16 10:31:59 esel dnsmasq[71879]: using nameserver 127.0.0.53#53
Jun 16 10:31:59 esel systemd-resolved[7766]: tel0: Bus client set search domain list to: tel2-search, bc-8828, ~svc, ~cluster.local.
Jun 16 10:31:59 esel systemd[1]: Starting NetworkManager-dispatcher.service - Network Manager Script Dispatcher Service...
Jun 16 10:31:59 esel systemd[1]: Started NetworkManager-dispatcher.service - Network Manager Script Dispatcher Service.
Jun 16 10:31:59 esel audit[1]: SERVICE_START pid=1 uid=0 auid=4294967295 ses=4294967295 subj=system_u:system_r:init_t:s0 msg='unit=NetworkManager-dispatcher comm="systemd" exe="/usr/lib/systemd/systemd" hostname=? addr=? terminal=? res=success'
Jun 16 10:31:59 esel NetworkManager[8336]: <info>  [1750062719.7013] device (tel0): state change: ip-check -> secondaries (reason 'none', managed-type: 'external')
Jun 16 10:31:59 esel NetworkManager[8336]: <info>  [1750062719.7015] device (tel0): state change: secondaries -> activated (reason 'none', managed-type: 'external')
Jun 16 10:31:59 esel NetworkManager[8336]: <info>  [1750062719.7017] device (tel0): Activation: successful, device activated.
Jun 16 10:31:59 esel systemd[1]: iscsi.service: Unit cannot be reloaded because it is inactive.
Jun 16 10:32:00 esel dnsmasq[71879]: reading /etc/resolv.conf
Jun 16 10:32:00 esel dnsmasq[71879]: using nameserver 127.0.0.53#53
Jun 16 10:32:00 esel dnsmasq[71879]: reading /etc/resolv.conf
Jun 16 10:32:00 esel dnsmasq[71879]: using nameserver 127.0.0.53#53
Jun 16 10:32:00 esel avahi-daemon[8112]: Withdrawing address record for 10.233.0.0 on tel0.
Jun 16 10:32:00 esel avahi-daemon[8112]: Leaving mDNS multicast group on interface tel0.IPv4 with address 10.233.0.0.
Jun 16 10:32:00 esel avahi-daemon[8112]: Joining mDNS multicast group on interface tel0.IPv4 with address 85.215.128.0.
Jun 16 10:32:00 esel avahi-daemon[8112]: Withdrawing address record for 10.209.0.0 on tel0.
Jun 16 10:32:00 esel avahi-daemon[8112]: Withdrawing address record for 10.210.177.0 on tel0.
Jun 16 10:32:00 esel avahi-daemon[8112]: Withdrawing address record for 10.211.74.0 on tel0.
Jun 16 10:32:00 esel avahi-daemon[8112]: Withdrawing address record for 10.213.0.0 on tel0.
Jun 16 10:32:00 esel avahi-daemon[8112]: Withdrawing address record for 10.217.252.0 on tel0.
Jun 16 10:32:00 esel avahi-daemon[8112]: Withdrawing address record for 10.219.127.0 on tel0.
Jun 16 10:32:00 esel avahi-daemon[8112]: Withdrawing address record for 10.220.96.0 on tel0.
Jun 16 10:32:00 esel avahi-daemon[8112]: Withdrawing address record for 10.221.164.0 on tel0.
Jun 16 10:32:00 esel avahi-daemon[8112]: Withdrawing address record for 85.215.128.0 on tel0.
Jun 16 10:32:00 esel avahi-daemon[8112]: Leaving mDNS multicast group on interface tel0.IPv4 with address 85.215.128.0.
Jun 16 10:32:00 esel avahi-daemon[8112]: Interface tel0.IPv4 no longer relevant for mDNS.
Jun 16 10:32:00 esel avahi-daemon[8112]: Interface tel0.IPv6 no longer relevant for mDNS.
Jun 16 10:32:00 esel avahi-daemon[8112]: Leaving mDNS multicast group on interface tel0.IPv6 with address fe80::f842:9fd4:4186:768f.
Jun 16 10:32:00 esel avahi-daemon[8112]: Withdrawing address record for fe80::f842:9fd4:4186:768f on tel0.
Jun 16 10:32:00 esel NetworkManager[8336]: <info>  [1750062720.3089] device (tel0): state change: activated -> unmanaged (reason 'unmanaged', managed-type: 'removed')
Jun 16 10:32:02 esel gvfsd[250764]: 2025-06-16 10:32:02,660:wsdd ERROR(pid 250764): error while sending packet on tel0: [Errno 101] Network is unreachable
Jun 16 10:32:02 esel gvfsd[250764]: 2025-06-16 10:32:02,660:asyncio ERROR(pid 250764): Exception in callback NetlinkAddressMonitor.handle_change()
Jun 16 10:32:02 esel gvfsd[250764]: handle: <Handle NetlinkAddressMonitor.handle_change()>
Jun 16 10:32:02 esel gvfsd[250764]: Traceback (most recent call last):
Jun 16 10:32:02 esel gvfsd[250764]:   File "/usr/lib64/python3.13/asyncio/events.py", line 89, in _run
Jun 16 10:32:02 esel gvfsd[250764]:     self._context.run(self._callback, *self._args)
Jun 16 10:32:02 esel gvfsd[250764]:     ~~~~~~~~~~~~~~~~~^^^^^^^^^^^^^^^^^^^^^^^^^^^^^
Jun 16 10:32:02 esel gvfsd[250764]:   File "/usr/bin/wsdd", line 1562, in handle_change
Jun 16 10:32:02 esel gvfsd[250764]:     self.handle_new_address(address)
Jun 16 10:32:02 esel gvfsd[250764]:     ~~~~~~~~~~~~~~~~~~~~~~~^^^^^^^^^
Jun 16 10:32:02 esel gvfsd[250764]:   File "/usr/bin/wsdd", line 1317, in handle_new_address
Jun 16 10:32:02 esel gvfsd[250764]:     mch = MulticastHandler(address, self.aio_loop)
Jun 16 10:32:02 esel gvfsd[250764]:   File "/usr/bin/wsdd", line 208, in __init__
Jun 16 10:32:02 esel gvfsd[250764]:     self.init_v4()
Jun 16 10:32:02 esel gvfsd[250764]:     ~~~~~~~~~~~~^^
Jun 16 10:32:02 esel gvfsd[250764]:   File "/usr/bin/wsdd", line 275, in init_v4
Jun 16 10:32:02 esel gvfsd[250764]:     self.recv_socket.setsockopt(socket.IPPROTO_IP, socket.IP_ADD_MEMBERSHIP, mreq)
Jun 16 10:32:02 esel gvfsd[250764]:     ~~~~~~~~~~~~~~~~~~~~~~~~~~~^^^^^^^^^^^^^^^^^^^^^^^^^^^^^^^^^^^^^^^^^^^^^^^^^^^
Jun 16 10:32:02 esel gvfsd[250764]: OSError: [Errno 19] No such device
Jun 16 10:32:02 esel gvfsd[250764]: 2025-06-16 10:32:02,661:asyncio ERROR(pid 250764): Exception in callback NetlinkAddressMonitor.handle_change()
Jun 16 10:32:02 esel gvfsd[250764]: handle: <Handle NetlinkAddressMonitor.handle_change()>
Jun 16 10:32:02 esel gvfsd[250764]: Traceback (most recent call last):
Jun 16 10:32:02 esel gvfsd[250764]:   File "/usr/lib64/python3.13/asyncio/events.py", line 89, in _run
Jun 16 10:32:02 esel gvfsd[250764]:     self._context.run(self._callback, *self._args)
Jun 16 10:32:02 esel gvfsd[250764]:     ~~~~~~~~~~~~~~~~~^^^^^^^^^^^^^^^^^^^^^^^^^^^^^
Jun 16 10:32:02 esel gvfsd[250764]:   File "/usr/bin/wsdd", line 1562, in handle_change
Jun 16 10:32:02 esel gvfsd[250764]:     self.handle_new_address(address)
Jun 16 10:32:02 esel gvfsd[250764]:     ~~~~~~~~~~~~~~~~~~~~~~~^^^^^^^^^
Jun 16 10:32:02 esel gvfsd[250764]:   File "/usr/bin/wsdd", line 1317, in handle_new_address
Jun 16 10:32:02 esel gvfsd[250764]:     mch = MulticastHandler(address, self.aio_loop)
Jun 16 10:32:02 esel gvfsd[250764]:   File "/usr/bin/wsdd", line 208, in __init__
Jun 16 10:32:02 esel gvfsd[250764]:     self.init_v4()
Jun 16 10:32:02 esel gvfsd[250764]:     ~~~~~~~~~~~~^^
Jun 16 10:32:02 esel gvfsd[250764]:   File "/usr/bin/wsdd", line 275, in init_v4
Jun 16 10:32:02 esel gvfsd[250764]:     self.recv_socket.setsockopt(socket.IPPROTO_IP, socket.IP_ADD_MEMBERSHIP, mreq)
Jun 16 10:32:02 esel gvfsd[250764]:     ~~~~~~~~~~~~~~~~~~~~~~~~~~~^^^^^^^^^^^^^^^^^^^^^^^^^^^^^^^^^^^^^^^^^^^^^^^^^^^
Jun 16 10:32:02 esel gvfsd[250764]: OSError: [Errno 19] No such device
Jun 16 10:32:02 esel gvfsd[250764]: 2025-06-16 10:32:02,663:asyncio ERROR(pid 250764): Exception in callback NetlinkAddressMonitor.handle_change()
Jun 16 10:32:02 esel gvfsd[250764]: handle: <Handle NetlinkAddressMonitor.handle_change()>
Jun 16 10:32:02 esel gvfsd[250764]: Traceback (most recent call last):
Jun 16 10:32:02 esel gvfsd[250764]:   File "/usr/lib64/python3.13/asyncio/events.py", line 89, in _run
Jun 16 10:32:02 esel gvfsd[250764]:     self._context.run(self._callback, *self._args)
Jun 16 10:32:02 esel gvfsd[250764]:     ~~~~~~~~~~~~~~~~~^^^^^^^^^^^^^^^^^^^^^^^^^^^^^
Jun 16 10:32:02 esel gvfsd[250764]:   File "/usr/bin/wsdd", line 1562, in handle_change
Jun 16 10:32:02 esel gvfsd[250764]:     self.handle_new_address(address)
Jun 16 10:32:02 esel gvfsd[250764]:     ~~~~~~~~~~~~~~~~~~~~~~~^^^^^^^^^
Jun 16 10:32:02 esel gvfsd[250764]:   File "/usr/bin/wsdd", line 1317, in handle_new_address
Jun 16 10:32:02 esel gvfsd[250764]:     mch = MulticastHandler(address, self.aio_loop)
Jun 16 10:32:02 esel gvfsd[250764]:   File "/usr/bin/wsdd", line 208, in __init__
Jun 16 10:32:02 esel gvfsd[250764]:     self.init_v4()
Jun 16 10:32:02 esel gvfsd[250764]:     ~~~~~~~~~~~~^^
Jun 16 10:32:02 esel gvfsd[250764]:   File "/usr/bin/wsdd", line 275, in init_v4
Jun 16 10:32:02 esel gvfsd[250764]:     self.recv_socket.setsockopt(socket.IPPROTO_IP, socket.IP_ADD_MEMBERSHIP, mreq)
Jun 16 10:32:02 esel gvfsd[250764]:     ~~~~~~~~~~~~~~~~~~~~~~~~~~~^^^^^^^^^^^^^^^^^^^^^^^^^^^^^^^^^^^^^^^^^^^^^^^^^^^
Jun 16 10:32:02 esel gvfsd[250764]: OSError: [Errno 19] No such device
Jun 16 10:32:02 esel gvfsd[250764]: 2025-06-16 10:32:02,665:asyncio ERROR(pid 250764): Exception in callback NetlinkAddressMonitor.handle_change()
Jun 16 10:32:02 esel gvfsd[250764]: handle: <Handle NetlinkAddressMonitor.handle_change()>
Jun 16 10:32:02 esel gvfsd[250764]: Traceback (most recent call last):
Jun 16 10:32:02 esel gvfsd[250764]:   File "/usr/lib64/python3.13/asyncio/events.py", line 89, in _run
Jun 16 10:32:02 esel gvfsd[250764]:     self._context.run(self._callback, *self._args)
Jun 16 10:32:02 esel gvfsd[250764]:     ~~~~~~~~~~~~~~~~~^^^^^^^^^^^^^^^^^^^^^^^^^^^^^
Jun 16 10:32:02 esel gvfsd[250764]:   File "/usr/bin/wsdd", line 1562, in handle_change
Jun 16 10:32:02 esel gvfsd[250764]:     self.handle_new_address(address)
Jun 16 10:32:02 esel gvfsd[250764]:     ~~~~~~~~~~~~~~~~~~~~~~~^^^^^^^^^
Jun 16 10:32:02 esel gvfsd[250764]:   File "/usr/bin/wsdd", line 1317, in handle_new_address
Jun 16 10:32:02 esel gvfsd[250764]:     mch = MulticastHandler(address, self.aio_loop)
Jun 16 10:32:02 esel gvfsd[250764]:   File "/usr/bin/wsdd", line 208, in __init__
Jun 16 10:32:02 esel gvfsd[250764]:     self.init_v4()
Jun 16 10:32:02 esel gvfsd[250764]:     ~~~~~~~~~~~~^^
Jun 16 10:32:02 esel gvfsd[250764]:   File "/usr/bin/wsdd", line 275, in init_v4
Jun 16 10:32:02 esel gvfsd[250764]:     self.recv_socket.setsockopt(socket.IPPROTO_IP, socket.IP_ADD_MEMBERSHIP, mreq)
Jun 16 10:32:02 esel gvfsd[250764]:     ~~~~~~~~~~~~~~~~~~~~~~~~~~~^^^^^^^^^^^^^^^^^^^^^^^^^^^^^^^^^^^^^^^^^^^^^^^^^^^
Jun 16 10:32:02 esel gvfsd[250764]: OSError: [Errno 19] No such device
Jun 16 10:32:02 esel gvfsd[250764]: 2025-06-16 10:32:02,666:asyncio ERROR(pid 250764): Exception in callback NetlinkAddressMonitor.handle_change()
Jun 16 10:32:02 esel gvfsd[250764]: handle: <Handle NetlinkAddressMonitor.handle_change()>
Jun 16 10:32:02 esel gvfsd[250764]: Traceback (most recent call last):
Jun 16 10:32:02 esel gvfsd[250764]:   File "/usr/lib64/python3.13/asyncio/events.py", line 89, in _run
Jun 16 10:32:02 esel gvfsd[250764]:     self._context.run(self._callback, *self._args)
Jun 16 10:32:02 esel gvfsd[250764]:     ~~~~~~~~~~~~~~~~~^^^^^^^^^^^^^^^^^^^^^^^^^^^^^
Jun 16 10:32:02 esel gvfsd[250764]:   File "/usr/bin/wsdd", line 1562, in handle_change
Jun 16 10:32:02 esel gvfsd[250764]:     self.handle_new_address(address)
Jun 16 10:32:02 esel gvfsd[250764]:     ~~~~~~~~~~~~~~~~~~~~~~~^^^^^^^^^
Jun 16 10:32:02 esel gvfsd[250764]:   File "/usr/bin/wsdd", line 1317, in handle_new_address
Jun 16 10:32:02 esel gvfsd[250764]:     mch = MulticastHandler(address, self.aio_loop)
Jun 16 10:32:02 esel gvfsd[250764]:   File "/usr/bin/wsdd", line 208, in __init__
Jun 16 10:32:02 esel gvfsd[250764]:     self.init_v4()
Jun 16 10:32:02 esel gvfsd[250764]:     ~~~~~~~~~~~~^^
Jun 16 10:32:02 esel gvfsd[250764]:   File "/usr/bin/wsdd", line 275, in init_v4
Jun 16 10:32:02 esel gvfsd[250764]:     self.recv_socket.setsockopt(socket.IPPROTO_IP, socket.IP_ADD_MEMBERSHIP, mreq)
Jun 16 10:32:02 esel gvfsd[250764]:     ~~~~~~~~~~~~~~~~~~~~~~~~~~~^^^^^^^^^^^^^^^^^^^^^^^^^^^^^^^^^^^^^^^^^^^^^^^^^^^
Jun 16 10:32:02 esel gvfsd[250764]: OSError: [Errno 19] No such device
Jun 16 10:32:02 esel gvfsd[250764]: 2025-06-16 10:32:02,667:asyncio ERROR(pid 250764): Exception in callback NetlinkAddressMonitor.handle_change()
Jun 16 10:32:02 esel gvfsd[250764]: handle: <Handle NetlinkAddressMonitor.handle_change()>
Jun 16 10:32:02 esel gvfsd[250764]: Traceback (most recent call last):
Jun 16 10:32:02 esel gvfsd[250764]:   File "/usr/lib64/python3.13/asyncio/events.py", line 89, in _run
Jun 16 10:32:02 esel gvfsd[250764]:     self._context.run(self._callback, *self._args)
Jun 16 10:32:02 esel gvfsd[250764]:     ~~~~~~~~~~~~~~~~~^^^^^^^^^^^^^^^^^^^^^^^^^^^^^
Jun 16 10:32:02 esel gvfsd[250764]:   File "/usr/bin/wsdd", line 1562, in handle_change
Jun 16 10:32:02 esel gvfsd[250764]:     self.handle_new_address(address)
Jun 16 10:32:02 esel gvfsd[250764]:     ~~~~~~~~~~~~~~~~~~~~~~~^^^^^^^^^
Jun 16 10:32:02 esel gvfsd[250764]:   File "/usr/bin/wsdd", line 1317, in handle_new_address
Jun 16 10:32:02 esel gvfsd[250764]:     mch = MulticastHandler(address, self.aio_loop)
Jun 16 10:32:02 esel gvfsd[250764]:   File "/usr/bin/wsdd", line 208, in __init__
Jun 16 10:32:02 esel gvfsd[250764]:     self.init_v4()
Jun 16 10:32:02 esel gvfsd[250764]:     ~~~~~~~~~~~~^^
Jun 16 10:32:02 esel gvfsd[250764]:   File "/usr/bin/wsdd", line 275, in init_v4
Jun 16 10:32:02 esel gvfsd[250764]:     self.recv_socket.setsockopt(socket.IPPROTO_IP, socket.IP_ADD_MEMBERSHIP, mreq)
Jun 16 10:32:02 esel gvfsd[250764]:     ~~~~~~~~~~~~~~~~~~~~~~~~~~~^^^^^^^^^^^^^^^^^^^^^^^^^^^^^^^^^^^^^^^^^^^^^^^^^^^
Jun 16 10:32:02 esel gvfsd[250764]: OSError: [Errno 19] No such device
Jun 16 10:32:02 esel gvfsd[250764]: 2025-06-16 10:32:02,668:asyncio ERROR(pid 250764): Exception in callback NetlinkAddressMonitor.handle_change()
Jun 16 10:32:02 esel gvfsd[250764]: handle: <Handle NetlinkAddressMonitor.handle_change()>
Jun 16 10:32:02 esel gvfsd[250764]: Traceback (most recent call last):
Jun 16 10:32:02 esel gvfsd[250764]:   File "/usr/lib64/python3.13/asyncio/events.py", line 89, in _run
Jun 16 10:32:02 esel gvfsd[250764]:     self._context.run(self._callback, *self._args)
Jun 16 10:32:02 esel gvfsd[250764]:     ~~~~~~~~~~~~~~~~~^^^^^^^^^^^^^^^^^^^^^^^^^^^^^
Jun 16 10:32:02 esel gvfsd[250764]:   File "/usr/bin/wsdd", line 1562, in handle_change
Jun 16 10:32:02 esel gvfsd[250764]:     self.handle_new_address(address)
Jun 16 10:32:02 esel gvfsd[250764]:     ~~~~~~~~~~~~~~~~~~~~~~~^^^^^^^^^
Jun 16 10:32:02 esel gvfsd[250764]:   File "/usr/bin/wsdd", line 1317, in handle_new_address
Jun 16 10:32:02 esel gvfsd[250764]:     mch = MulticastHandler(address, self.aio_loop)
Jun 16 10:32:02 esel gvfsd[250764]:   File "/usr/bin/wsdd", line 208, in __init__
Jun 16 10:32:02 esel gvfsd[250764]:     self.init_v4()
Jun 16 10:32:02 esel gvfsd[250764]:     ~~~~~~~~~~~~^^
Jun 16 10:32:02 esel gvfsd[250764]:   File "/usr/bin/wsdd", line 275, in init_v4
Jun 16 10:32:02 esel gvfsd[250764]:     self.recv_socket.setsockopt(socket.IPPROTO_IP, socket.IP_ADD_MEMBERSHIP, mreq)
Jun 16 10:32:02 esel gvfsd[250764]:     ~~~~~~~~~~~~~~~~~~~~~~~~~~~^^^^^^^^^^^^^^^^^^^^^^^^^^^^^^^^^^^^^^^^^^^^^^^^^^^
Jun 16 10:32:02 esel gvfsd[250764]: OSError: [Errno 19] No such device
Jun 16 10:32:02 esel gvfsd[250764]: 2025-06-16 10:32:02,669:asyncio ERROR(pid 250764): Exception in callback NetlinkAddressMonitor.handle_change()
Jun 16 10:32:02 esel gvfsd[250764]: handle: <Handle NetlinkAddressMonitor.handle_change()>
Jun 16 10:32:02 esel gvfsd[250764]: Traceback (most recent call last):
Jun 16 10:32:02 esel gvfsd[250764]:   File "/usr/lib64/python3.13/asyncio/events.py", line 89, in _run
Jun 16 10:32:02 esel gvfsd[250764]:     self._context.run(self._callback, *self._args)
Jun 16 10:32:02 esel gvfsd[250764]:     ~~~~~~~~~~~~~~~~~^^^^^^^^^^^^^^^^^^^^^^^^^^^^^
Jun 16 10:32:02 esel gvfsd[250764]:   File "/usr/bin/wsdd", line 1562, in handle_change
Jun 16 10:32:02 esel gvfsd[250764]:     self.handle_new_address(address)
Jun 16 10:32:02 esel gvfsd[250764]:     ~~~~~~~~~~~~~~~~~~~~~~~^^^^^^^^^
Jun 16 10:32:02 esel gvfsd[250764]:   File "/usr/bin/wsdd", line 1317, in handle_new_address
Jun 16 10:32:02 esel gvfsd[250764]:     mch = MulticastHandler(address, self.aio_loop)
Jun 16 10:32:02 esel gvfsd[250764]:   File "/usr/bin/wsdd", line 208, in __init__
Jun 16 10:32:02 esel gvfsd[250764]:     self.init_v4()
Jun 16 10:32:02 esel gvfsd[250764]:     ~~~~~~~~~~~~^^
Jun 16 10:32:02 esel gvfsd[250764]:   File "/usr/bin/wsdd", line 275, in init_v4
Jun 16 10:32:02 esel gvfsd[250764]:     self.recv_socket.setsockopt(socket.IPPROTO_IP, socket.IP_ADD_MEMBERSHIP, mreq)
Jun 16 10:32:02 esel gvfsd[250764]:     ~~~~~~~~~~~~~~~~~~~~~~~~~~~^^^^^^^^^^^^^^^^^^^^^^^^^^^^^^^^^^^^^^^^^^^^^^^^^^^
Jun 16 10:32:02 esel gvfsd[250764]: OSError: [Errno 19] No such device
Jun 16 10:32:02 esel gvfsd[250764]: 2025-06-16 10:32:02,670:asyncio ERROR(pid 250764): Exception in callback NetlinkAddressMonitor.handle_change()
Jun 16 10:32:02 esel gvfsd[250764]: handle: <Handle NetlinkAddressMonitor.handle_change()>
Jun 16 10:32:02 esel gvfsd[250764]: Traceback (most recent call last):
Jun 16 10:32:02 esel gvfsd[250764]:   File "/usr/lib64/python3.13/asyncio/events.py", line 89, in _run
Jun 16 10:32:02 esel gvfsd[250764]:     self._context.run(self._callback, *self._args)
Jun 16 10:32:02 esel gvfsd[250764]:     ~~~~~~~~~~~~~~~~~^^^^^^^^^^^^^^^^^^^^^^^^^^^^^
Jun 16 10:32:02 esel gvfsd[250764]:   File "/usr/bin/wsdd", line 1562, in handle_change
Jun 16 10:32:02 esel gvfsd[250764]:     self.handle_new_address(address)
Jun 16 10:32:02 esel gvfsd[250764]:     ~~~~~~~~~~~~~~~~~~~~~~~^^^^^^^^^
Jun 16 10:32:02 esel gvfsd[250764]:   File "/usr/bin/wsdd", line 1317, in handle_new_address
Jun 16 10:32:02 esel gvfsd[250764]:     mch = MulticastHandler(address, self.aio_loop)
Jun 16 10:32:02 esel gvfsd[250764]:   File "/usr/bin/wsdd", line 208, in __init__
Jun 16 10:32:02 esel gvfsd[250764]:     self.init_v4()
Jun 16 10:32:02 esel gvfsd[250764]:     ~~~~~~~~~~~~^^
Jun 16 10:32:02 esel gvfsd[250764]:   File "/usr/bin/wsdd", line 275, in init_v4
Jun 16 10:32:02 esel gvfsd[250764]:     self.recv_socket.setsockopt(socket.IPPROTO_IP, socket.IP_ADD_MEMBERSHIP, mreq)
Jun 16 10:32:02 esel gvfsd[250764]:     ~~~~~~~~~~~~~~~~~~~~~~~~~~~^^^^^^^^^^^^^^^^^^^^^^^^^^^^^^^^^^^^^^^^^^^^^^^^^^^
Jun 16 10:32:02 esel gvfsd[250764]: OSError: [Errno 19] No such device
Jun 16 10:32:02 esel gvfsd[250764]: 2025-06-16 10:32:02,671:asyncio ERROR(pid 250764): Exception in callback NetlinkAddressMonitor.handle_change()
Jun 16 10:32:02 esel gvfsd[250764]: handle: <Handle NetlinkAddressMonitor.handle_change()>
Jun 16 10:32:02 esel gvfsd[250764]: Traceback (most recent call last):
Jun 16 10:32:02 esel gvfsd[250764]:   File "/usr/lib64/python3.13/asyncio/events.py", line 89, in _run
Jun 16 10:32:02 esel gvfsd[250764]:     self._context.run(self._callback, *self._args)
Jun 16 10:32:02 esel gvfsd[250764]:     ~~~~~~~~~~~~~~~~~^^^^^^^^^^^^^^^^^^^^^^^^^^^^^
Jun 16 10:32:02 esel gvfsd[250764]:   File "/usr/bin/wsdd", line 1562, in handle_change
Jun 16 10:32:02 esel gvfsd[250764]:     self.handle_new_address(address)
Jun 16 10:32:02 esel gvfsd[250764]:     ~~~~~~~~~~~~~~~~~~~~~~~^^^^^^^^^
Jun 16 10:32:02 esel gvfsd[250764]:   File "/usr/bin/wsdd", line 1317, in handle_new_address
Jun 16 10:32:02 esel gvfsd[250764]:     mch = MulticastHandler(address, self.aio_loop)
Jun 16 10:32:02 esel gvfsd[250764]:   File "/usr/bin/wsdd", line 208, in __init__
Jun 16 10:32:02 esel gvfsd[250764]:     self.init_v4()
Jun 16 10:32:02 esel gvfsd[250764]:     ~~~~~~~~~~~~^^
Jun 16 10:32:02 esel gvfsd[250764]:   File "/usr/bin/wsdd", line 275, in init_v4
Jun 16 10:32:02 esel gvfsd[250764]:     self.recv_socket.setsockopt(socket.IPPROTO_IP, socket.IP_ADD_MEMBERSHIP, mreq)
Jun 16 10:32:02 esel gvfsd[250764]:     ~~~~~~~~~~~~~~~~~~~~~~~~~~~^^^^^^^^^^^^^^^^^^^^^^^^^^^^^^^^^^^^^^^^^^^^^^^^^^^
Jun 16 10:32:02 esel gvfsd[250764]: OSError: [Errno 19] No such device
Jun 16 10:32:02 esel gvfsd[250764]: 2025-06-16 10:32:02,732:wsdd ERROR(pid 250764): error while sending packet on tel0: [Errno 9] Bad file descriptor
Jun 16 10:32:02 esel gvfsd[250764]: 2025-06-16 10:32:02,878:wsdd ERROR(pid 250764): error while sending packet on tel0: [Errno 9] Bad file descriptor
Jun 16 10:32:03 esel gvfsd[250764]: 2025-06-16 10:32:03,167:wsdd ERROR(pid 250764): error while sending packet on tel0: [Errno 9] Bad file descriptor
```

**Comment by thallgren** [comment]
I see that you have dnsmasq and avahi-daemon configured. Not sure if it's relevant, but it makes the problem harder to find. This looks suspicious:
```
Jun 16 10:32:00 esel avahi-daemon[8112]: Withdrawing address record for 10.233.0.0 on tel0.
Jun 16 10:32:00 esel avahi-daemon[8112]: Leaving mDNS multicast group on interface tel0.IPv4 with address 10.233.0.0.
Jun 16 10:32:00 esel avahi-daemon[8112]: Joining mDNS multicast group on interface tel0.IPv4 with address 85.215.128.0.
Jun 16 10:32:00 esel avahi-daemon[8112]: Withdrawing address record for 10.209.0.0 on tel0.
Jun 16 10:32:00 esel avahi-daemon[8112]: Withdrawing address record for 10.210.177.0 on tel0.
Jun 16 10:32:00 esel avahi-daemon[8112]: Withdrawing address record for 10.211.74.0 on tel0.
Jun 16 10:32:00 esel avahi-daemon[8112]: Withdrawing address record for 10.213.0.0 on tel0.
Jun 16 10:32:00 esel avahi-daemon[8112]: Withdrawing address record for 10.217.252.0 on tel0.
Jun 16 10:32:00 esel avahi-daemon[8112]: Withdrawing address record for 10.219.127.0 on tel0.
Jun 16 10:32:00 esel avahi-daemon[8112]: Withdrawing address record for 10.220.96.0 on tel0.
Jun 16 10:32:00 esel avahi-daemon[8112]: Withdrawing address record for 10.221.164.0 on tel0.
Jun 16 10:32:00 esel avahi-daemon[8112]: Withdrawing address record for 85.215.128.0 on tel0.
Jun 16 10:32:00 esel avahi-daemon[8112]: Leaving mDNS multicast group on interface tel0.IPv4 with address 85.215.128.0.
Jun 16 10:32:00 esel avahi-daemon[8112]: Interface tel0.IPv4 no longer relevant for mDNS.
Jun 16 10:32:00 esel avahi-daemon[8112]: Interface tel0.IPv6 no longer relevant for mDNS.
Jun 16 10:32:00 esel avahi-daemon[8112]: Leaving mDNS multicast group on interface tel0.IPv6 with address fe80::f842:9fd4:4186:768f.
Jun 16 10:32:00 esel avahi-daemon[8112]: Withdrawing address record for fe80::f842:9fd4:4186:768f on tel0.
```

It is directly followed by this, which is the root cause:
```
Jun 16 10:32:00 esel NetworkManager[8336]: <info>  [1750062720.3089] device (tel0): state change: activated -> unmanaged (reason 'unmanaged', managed-type: 'removed')
Jun 16 10:32:02 esel gvfsd[250764]: 2025-06-16 10:32:02,660:wsdd ERROR(pid 250764): error while sending packet on tel0: [Errno 101] Network is unreachable
```

Any chance you can try without the avahi-daemon? And if that doesn't help, without dnsmasq?

**Comment by Loki-Afro** [comment]
@thallgren i'll try that today and i got other news it works on freaking windows 10, so the problem is most likely not related to the traffic-manager :)

**Comment by Loki-Afro** [comment]
hey @thallgren avahi-daemon has been stopped, i do have dnsmasq installed, but not running the daemon, it is managed by libvirtd, i also stopped that, stopped all the networks, and now there is no dnsmasq process running anymore

same issue though
```
Jun 16 21:11:46 esel sudo[2061694]: pam_unix(sudo:session): session closed for user root
Jun 16 21:11:46 esel audit[2061694]: USER_END pid=2061694 uid=1000 auid=1000 ses=1 subj=unconfined_u:unconfined_r:unconfined_t:s0-s0:c0.c1023 msg='op=PAM:session_close grantors=pam_keyinit,pam_limits,pam_keyinit,pam_limits,pam_systemd,pam_unix acct="root" exe="/usr/bin/sudo" hostname=? addr=? terminal=/dev/pts/8 res=success'
Jun 16 21:11:46 esel audit[2061694]: CRED_DISP pid=2061694 uid=1000 auid=1000 ses=1 subj=unconfined_u:unconfined_r:unconfined_t:s0-s0:c0.c1023 msg='op=PAM:setcred grantors=pam_unix acct="root" exe="/usr/bin/sudo" hostname=? addr=? terminal=/dev/pts/8 res=success'
Jun 16 21:11:46 esel systemd[1]: session-c42.scope: Deactivated successfully.
Jun 16 21:11:46 esel systemd-logind[8142]: Session c42 logged out. Waiting for processes to exit.
Jun 16 21:11:46 esel systemd-logind[8142]: Removed session c42.
Jun 16 21:11:48 esel audit[2063229]: USER_ACCT pid=2063229 uid=1000 auid=1000 ses=1 subj=unconfined_u:unconfined_r:unconfined_t:s0-s0:c0.c1023 msg='op=PAM:accounting grantors=pam_unix acct="zarathustra" exe="/usr/bin/sudo" hostname=? addr=? terminal=/dev/pts/8 res=success'
Jun 16 21:11:48 esel sudo[2063229]: zarathustra : TTY=pts/8 ; PWD=/home/zarathustra/code/schulcloud-calendar/tmp-telepresence ; USER=root ; COMMAND=/usr/local/bin/telepresence daemon-foreground /home/zarathustra/.cache/telepresence/logs /home/zarathustra/.config/telepresence
Jun 16 21:11:48 esel audit[2063229]: USER_CMD pid=2063229 uid=1000 auid=1000 ses=1 subj=unconfined_u:unconfined_r:unconfined_t:s0-s0:c0.c1023 msg='cwd="/home/zarathustra/code/schulcloud-calendar/tmp-telepresence" cmd=2F7573722F6C6F63616C2F62696E2F74656C6570726573656E6365206461656D6F6E2D666F726567726F756E64202F686F6D652F7A617261746875737472612F2E63616368652F74656C6570726573656E63652F6C6F6773202F686F6D652F7A617261746875737472612F2E636F6E6669672F74656C6570726573656E6365 exe="/usr/bin/sudo" terminal=? res=success'
Jun 16 21:11:48 esel audit[2063231]: CRED_REFR pid=2063231 uid=1000 auid=1000 ses=1 subj=unconfined_u:unconfined_r:unconfined_t:s0-s0:c0.c1023 msg='op=PAM:setcred grantors=pam_env,pam_unix acct="root" exe="/usr/bin/sudo" hostname=? addr=? terminal=/dev/pts/8 res=success'
Jun 16 21:11:48 esel systemd-logind[8142]: Existing logind session ID 1 used by new audit session, ignoring.
Jun 16 21:11:48 esel systemd-logind[8142]: New session c43 of user root.
Jun 16 21:11:48 esel systemd[1]: Started session-c43.scope - Session c43 of User root.
Jun 16 21:11:48 esel sudo[2063231]: pam_unix(sudo:session): session opened for user root(uid=0) by zarathustra(uid=1000)
Jun 16 21:11:48 esel audit[2063231]: USER_START pid=2063231 uid=1000 auid=1000 ses=1 subj=unconfined_u:unconfined_r:unconfined_t:s0-s0:c0.c1023 msg='op=PAM:session_open grantors=pam_keyinit,pam_limits,pam_keyinit,pam_limits,pam_systemd,pam_unix acct="root" exe="/usr/bin/sudo" hostname=? addr=? terminal=/dev/pts/8 res=success'
Jun 16 21:11:51 esel NetworkManager[8336]: <info>  [1750101111.0289] manager: (tel0): new Tun device (/org/freedesktop/NetworkManager/Devices/78)
Jun 16 21:11:51 esel systemd-resolved[7766]: tel0: Bus client set DNS server list to: 10.213.51.9
Jun 16 21:11:51 esel systemd-resolved[7766]: tel0: Bus client set search domain list to: tel2-search, ~cluster.local.
Jun 16 21:11:51 esel systemd-resolved[7766]: Using degraded feature set UDP instead of UDP+EDNS0 for DNS server 10.213.51.9.
Jun 16 21:11:51 esel systemd-resolved[7766]: tel0: Bus client set search domain list to: tel2-search, bc-8828, ~svc, ~cluster.local.
Jun 16 21:11:51 esel NetworkManager[8336]: <info>  [1750101111.0492] device (tel0): state change: unmanaged -> unavailable (reason 'connection-assumed', managed-type: 'external')
Jun 16 21:11:51 esel NetworkManager[8336]: <info>  [1750101111.0495] device (tel0): state change: unavailable -> disconnected (reason 'connection-assumed', managed-type: 'external')
Jun 16 21:11:51 esel NetworkManager[8336]: <info>  [1750101111.0499] device (tel0): Activation: starting connection 'tel0' (fcb555cb-3544-406b-bc75-05ac39f0e69d)
Jun 16 21:11:51 esel NetworkManager[8336]: <info>  [1750101111.0507] device (tel0): state change: disconnected -> prepare (reason 'none', managed-type: 'external')
Jun 16 21:11:51 esel NetworkManager[8336]: <info>  [1750101111.0508] device (tel0): state change: prepare -> config (reason 'none', managed-type: 'external')
Jun 16 21:11:51 esel NetworkManager[8336]: <info>  [1750101111.0510] device (tel0): state change: config -> ip-config (reason 'none', managed-type: 'external')
Jun 16 21:11:51 esel NetworkManager[8336]: <info>  [1750101111.0512] device (tel0): state change: ip-config -> ip-check (reason 'none', managed-type: 'external')
Jun 16 21:11:51 esel systemd[1]: Starting NetworkManager-dispatcher.service - Network Manager Script Dispatcher Service...
Jun 16 21:11:51 esel systemd[1]: Started NetworkManager-dispatcher.service - Network Manager Script Dispatcher Service.
Jun 16 21:11:51 esel audit[1]: SERVICE_START pid=1 uid=0 auid=4294967295 ses=4294967295 subj=system_u:system_r:init_t:s0 msg='unit=NetworkManager-dispatcher comm="systemd" exe="/usr/lib/systemd/systemd" hostname=? addr=? terminal=? res=success'
Jun 16 21:11:51 esel NetworkManager[8336]: <info>  [1750101111.0746] device (tel0): state change: ip-check -> secondaries (reason 'none', managed-type: 'external')
Jun 16 21:11:51 esel NetworkManager[8336]: <info>  [1750101111.0747] device (tel0): state change: secondaries -> activated (reason 'none', managed-type: 'external')
Jun 16 21:11:51 esel NetworkManager[8336]: <info>  [1750101111.0749] device (tel0): Activation: successful, device activated.
Jun 16 21:11:51 esel systemd[1]: iscsi.service: Unit cannot be reloaded because it is inactive.
Jun 16 21:11:54 esel NetworkManager[8336]: <info>  [1750101114.9130] device (tel0): state change: activated -> unmanaged (reason 'unmanaged', managed-type: 'removed')
Jun 16 21:11:55 esel gvfsd[250764]: 2025-06-16 21:11:55,029:wsdd ERROR(pid 250764): error while sending packet on tel0: [Errno 101] Network is unreachable
Jun 16 21:11:55 esel gvfsd[250764]: 2025-06-16 21:11:55,029:asyncio ERROR(pid 250764): Exception in callback NetlinkAddressMonitor.handle_change()
Jun 16 21:11:55 esel gvfsd[250764]: handle: <Handle NetlinkAddressMonitor.handle_change()>
Jun 16 21:11:55 esel gvfsd[250764]: Traceback (most recent call last):
Jun 16 21:11:55 esel gvfsd[250764]:   File "/usr/lib64/python3.13/asyncio/events.py", line 89, in _run
Jun 16 21:11:55 esel gvfsd[250764]:     self._context.run(self._callback, *self._args)
Jun 16 21:11:55 esel gvfsd[250764]:     ~~~~~~~~~~~~~~~~~^^^^^^^^^^^^^^^^^^^^^^^^^^^^^
Jun 16 21:11:55 esel gvfsd[250764]:   File "/usr/bin/wsdd", line 1562, in handle_change
Jun 16 21:11:55 esel gvfsd[250764]:     self.handle_new_address(address)
Jun 16 21:11:55 esel gvfsd[250764]:     ~~~~~~~~~~~~~~~~~~~~~~~^^^^^^^^^
Jun 16 21:11:55 esel gvfsd[250764]:   File "/usr/bin/wsdd", line 1317, in handle_new_address
Jun 16 21:11:55 esel gvfsd[250764]:     mch = MulticastHandler(address, self.aio_loop)
Jun 16 21:11:55 esel gvfsd[250764]:   File "/usr/bin/wsdd", line 208, in __init__
Jun 16 21:11:55 esel gvfsd[250764]:     self.init_v4()
Jun 16 21:11:55 esel gvfsd[250764]:     ~~~~~~~~~~~~^^
Jun 16 21:11:55 esel gvfsd[250764]:   File "/usr/bin/wsdd", line 275, in init_v4
Jun 16 21:11:55 esel gvfsd[250764]:     self.recv_socket.setsockopt(socket.IPPROTO_IP, socket.IP_ADD_MEMBERSHIP, mreq)
Jun 16 21:11:55 esel gvfsd[250764]:     ~~~~~~~~~~~~~~~~~~~~~~~~~~~^^^^^^^^^^^^^^^^^^^^^^^^^^^^^^^^^^^^^^^^^^^^^^^^^^^
Jun 16 21:11:55 esel gvfsd[250764]: OSError: [Errno 19] No such device
Jun 16 21:11:55 esel gvfsd[250764]: 2025-06-16 21:11:55,030:wsdd ERROR(pid 250764): error while sending packet on tel0: [Errno 101] Network is unreachable
Jun 16 21:11:55 esel gvfsd[250764]: 2025-06-16 21:11:55,030:wsdd ERROR(pid 250764): error while sending packet on tel0: [Errno 101] Network is unreachable
Jun 16 21:11:55 esel gvfsd[250764]: 2025-06-16 21:11:55,030:asyncio ERROR(pid 250764): Exception in callback NetlinkAddressMonitor.handle_change()
Jun 16 21:11:55 esel gvfsd[250764]: handle: <Handle NetlinkAddressMonitor.handle_change()>
Jun 16 21:11:55 esel gvfsd[250764]: Traceback (most recent call last):
Jun 16 21:11:55 esel gvfsd[250764]:   File "/usr/lib64/python3.13/asyncio/events.py", line 89, in _run
Jun 16 21:11:55 esel gvfsd[250764]:     self._context.run(self._callback, *self._args)
Jun 16 21:11:55 esel gvfsd[250764]:     ~~~~~~~~~~~~~~~~~^^^^^^^^^^^^^^^^^^^^^^^^^^^^^
Jun 16 21:11:55 esel gvfsd[250764]:   File "/usr/bin/wsdd", line 1562, in handle_change
Jun 16 21:11:55 esel gvfsd[250764]:     self.handle_new_address(address)
Jun 16 21:11:55 esel gvfsd[250764]:     ~~~~~~~~~~~~~~~~~~~~~~~^^^^^^^^^
Jun 16 21:11:55 esel gvfsd[250764]:   File "/usr/bin/wsdd", line 1317, in handle_new_address
Jun 16 21:11:55 esel gvfsd[250764]:     mch = MulticastHandler(address, self.aio_loop)
Jun 16 21:11:55 esel gvfsd[250764]:   File "/usr/bin/wsdd", line 208, in __init__
Jun 16 21:11:55 esel gvfsd[250764]:     self.init_v4()
Jun 16 21:11:55 esel gvfsd[250764]:     ~~~~~~~~~~~~^^
Jun 16 21:11:55 esel gvfsd[250764]:   File "/usr/bin/wsdd", line 275, in init_v4
Jun 16 21:11:55 esel gvfsd[250764]:     self.recv_socket.setsockopt(socket.IPPROTO_IP, socket.IP_ADD_MEMBERSHIP, mreq)
Jun 16 21:11:55 esel gvfsd[250764]:     ~~~~~~~~~~~~~~~~~~~~~~~~~~~^^^^^^^^^^^^^^^^^^^^^^^^^^^^^^^^^^^^^^^^^^^^^^^^^^^
Jun 16 21:11:55 esel gvfsd[250764]: OSError: [Errno 19] No such device
Jun 16 21:11:55 esel gvfsd[250764]: 2025-06-16 21:11:55,031:asyncio ERROR(pid 250764): Exception in callback NetlinkAddressMonitor.handle_change()
Jun 16 21:11:55 esel gvfsd[250764]: handle: <Handle NetlinkAddressMonitor.handle_change()>
Jun 16 21:11:55 esel gvfsd[250764]: Traceback (most recent call last):
Jun 16 21:11:55 esel gvfsd[250764]:   File "/usr/lib64/python3.13/asyncio/events.py", line 89, in _run
Jun 16 21:11:55 esel gvfsd[250764]:     self._context.run(self._callback, *self._args)
Jun 16 21:11:55 esel gvfsd[250764]:     ~~~~~~~~~~~~~~~~~^^^^^^^^^^^^^^^^^^^^^^^^^^^^^
Jun 16 21:11:55 esel gvfsd[250764]:   File "/usr/bin/wsdd", line 1562, in handle_change
Jun 16 21:11:55 esel gvfsd[250764]:     self.handle_new_address(address)
Jun 16 21:11:55 esel gvfsd[250764]:     ~~~~~~~~~~~~~~~~~~~~~~~^^^^^^^^^
Jun 16 21:11:55 esel gvfsd[250764]:   File "/usr/bin/wsdd", line 1317, in handle_new_address
Jun 16 21:11:55 esel gvfsd[250764]:     mch = MulticastHandler(address, self.aio_loop)
Jun 16 21:11:55 esel gvfsd[250764]:   File "/usr/bin/wsdd", line 208, in __init__
Jun 16 21:11:55 esel gvfsd[250764]:     self.init_v4()
Jun 16 21:11:55 esel gvfsd[250764]:     ~~~~~~~~~~~~^^
Jun 16 21:11:55 esel gvfsd[250764]:   File "/usr/bin/wsdd", line 275, in init_v4
Jun 16 21:11:55 esel gvfsd[250764]:     self.recv_socket.setsockopt(socket.IPPROTO_IP, socket.IP_ADD_MEMBERSHIP, mreq)
Jun 16 21:11:55 esel gvfsd[250764]:     ~~~~~~~~~~~~~~~~~~~~~~~~~~~^^^^^^^^^^^^^^^^^^^^^^^^^^^^^^^^^^^^^^^^^^^^^^^^^^^
Jun 16 21:11:55 esel gvfsd[250764]: OSError: [Errno 19] No such device
Jun 16 21:11:55 esel gvfsd[250764]: 2025-06-16 21:11:55,031:asyncio ERROR(pid 250764): Exception in callback NetlinkAddressMonitor.handle_change()
Jun 16 21:11:55 esel gvfsd[250764]: handle: <Handle NetlinkAddressMonitor.handle_change()>
Jun 16 21:11:55 esel gvfsd[250764]: Traceback (most recent call last):
Jun 16 21:11:55 esel gvfsd[250764]:   File "/usr/lib64/python3.13/asyncio/events.py", line 89, in _run
Jun 16 21:11:55 esel gvfsd[250764]:     self._context.run(self._callback, *self._args)
Jun 16 21:11:55 esel gvfsd[250764]:     ~~~~~~~~~~~~~~~~~^^^^^^^^^^^^^^^^^^^^^^^^^^^^^
Jun 16 21:11:55 esel gvfsd[250764]:   File "/usr/bin/wsdd", line 1562, in handle_change
Jun 16 21:11:55 esel gvfsd[250764]:     self.handle_new_address(address)
Jun 16 21:11:55 esel gvfsd[250764]:     ~~~~~~~~~~~~~~~~~~~~~~~^^^^^^^^^
Jun 16 21:11:55 esel gvfsd[250764]:   File "/usr/bin/wsdd", line 1317, in handle_new_address
Jun 16 21:11:55 esel gvfsd[250764]:     mch = MulticastHandler(address, self.aio_loop)
Jun 16 21:11:55 esel gvfsd[250764]:   File "/usr/bin/wsdd", line 208, in __init__
Jun 16 21:11:55 esel gvfsd[250764]:     self.init_v4()
Jun 16 21:11:55 esel gvfsd[250764]:     ~~~~~~~~~~~~^^
Jun 16 21:11:55 esel gvfsd[250764]:   File "/usr/bin/wsdd", line 275, in init_v4
Jun 16 21:11:55 esel gvfsd[250764]:     self.recv_socket.setsockopt(socket.IPPROTO_IP, socket.IP_ADD_MEMBERSHIP, mreq)
Jun 16 21:11:55 esel gvfsd[250764]:     ~~~~~~~~~~~~~~~~~~~~~~~~~~~^^^^^^^^^^^^^^^^^^^^^^^^^^^^^^^^^^^^^^^^^^^^^^^^^^^
Jun 16 21:11:55 esel gvfsd[250764]: OSError: [Errno 19] No such device
Jun 16 21:11:55 esel gvfsd[250764]: 2025-06-16 21:11:55,032:asyncio ERROR(pid 250764): Exception in callback NetlinkAddressMonitor.handle_change()
Jun 16 21:11:55 esel gvfsd[250764]: handle: <Handle NetlinkAddressMonitor.handle_change()>
Jun 16 21:11:55 esel gvfsd[250764]: Traceback (most recent call last):
Jun 16 21:11:55 esel gvfsd[250764]:   File "/usr/lib64/python3.13/asyncio/events.py", line 89, in _run
Jun 16 21:11:55 esel gvfsd[250764]:     self._context.run(self._callback, *self._args)
Jun 16 21:11:55 esel gvfsd[250764]:     ~~~~~~~~~~~~~~~~~^^^^^^^^^^^^^^^^^^^^^^^^^^^^^
Jun 16 21:11:55 esel gvfsd[250764]:   File "/usr/bin/wsdd", line 1562, in handle_change
Jun 16 21:11:55 esel gvfsd[250764]:     self.handle_new_address(address)
Jun 16 21:11:55 esel gvfsd[250764]:     ~~~~~~~~~~~~~~~~~~~~~~~^^^^^^^^^
Jun 16 21:11:55 esel gvfsd[250764]:   File "/usr/bin/wsdd", line 1317, in handle_new_address
Jun 16 21:11:55 esel gvfsd[250764]:     mch = MulticastHandler(address, self.aio_loop)
Jun 16 21:11:55 esel gvfsd[250764]:   File "/usr/bin/wsdd", line 208, in __init__
Jun 16 21:11:55 esel gvfsd[250764]:     self.init_v4()
Jun 16 21:11:55 esel gvfsd[250764]:     ~~~~~~~~~~~~^^
Jun 16 21:11:55 esel gvfsd[250764]:   File "/usr/bin/wsdd", line 275, in init_v4
Jun 16 21:11:55 esel gvfsd[250764]:     self.recv_socket.setsockopt(socket.IPPROTO_IP, socket.IP_ADD_MEMBERSHIP, mreq)
Jun 16 21:11:55 esel gvfsd[250764]:     ~~~~~~~~~~~~~~~~~~~~~~~~~~~^^^^^^^^^^^^^^^^^^^^^^^^^^^^^^^^^^^^^^^^^^^^^^^^^^^
Jun 16 21:11:55 esel gvfsd[250764]: OSError: [Errno 19] No such device
Jun 16 21:11:55 esel gvfsd[250764]: 2025-06-16 21:11:55,033:asyncio ERROR(pid 250764): Exception in callback NetlinkAddressMonitor.handle_change()
Jun 16 21:11:55 esel gvfsd[250764]: handle: <Handle NetlinkAddressMonitor.handle_change()>
Jun 16 21:11:55 esel gvfsd[250764]: Traceback (most recent call last):
Jun 16 21:11:55 esel gvfsd[250764]:   File "/usr/lib64/python3.13/asyncio/events.py", line 89, in _run
Jun 16 21:11:55 esel gvfsd[250764]:     self._context.run(self._callback, *self._args)
Jun 16 21:11:55 esel gvfsd[250764]:     ~~~~~~~~~~~~~~~~~^^^^^^^^^^^^^^^^^^^^^^^^^^^^^
Jun 16 21:11:55 esel gvfsd[250764]:   File "/usr/bin/wsdd", line 1562, in handle_change
Jun 16 21:11:55 esel gvfsd[250764]:     self.handle_new_address(address)
Jun 16 21:11:55 esel gvfsd[250764]:     ~~~~~~~~~~~~~~~~~~~~~~~^^^^^^^^^
Jun 16 21:11:55 esel gvfsd[250764]:   File "/usr/bin/wsdd", line 1317, in handle_new_address
Jun 16 21:11:55 esel gvfsd[250764]:     mch = MulticastHandler(address, self.aio_loop)
Jun 16 21:11:55 esel gvfsd[250764]:   File "/usr/bin/wsdd", line 208, in __init__
Jun 16 21:11:55 esel gvfsd[250764]:     self.init_v4()
Jun 16 21:11:55 esel gvfsd[250764]:     ~~~~~~~~~~~~^^
Jun 16 21:11:55 esel gvfsd[250764]:   File "/usr/bin/wsdd", line 275, in init_v4
Jun 16 21:11:55 esel gvfsd[250764]:     self.recv_socket.setsockopt(socket.IPPROTO_IP, socket.IP_ADD_MEMBERSHIP, mreq)
Jun 16 21:11:55 esel gvfsd[250764]:     ~~~~~~~~~~~~~~~~~~~~~~~~~~~^^^^^^^^^^^^^^^^^^^^^^^^^^^^^^^^^^^^^^^^^^^^^^^^^^^
Jun 16 21:11:55 esel gvfsd[250764]: OSError: [Errno 19] No such device
Jun 16 21:11:55 esel gvfsd[250764]: 2025-06-16 21:11:55,034:asyncio ERROR(pid 250764): Exception in callback NetlinkAddressMonitor.handle_change()
Jun 16 21:11:55 esel gvfsd[250764]: handle: <Handle NetlinkAddressMonitor.handle_change()>
Jun 16 21:11:55 esel gvfsd[250764]: Traceback (most recent call last):
Jun 16 21:11:55 esel gvfsd[250764]:   File "/usr/lib64/python3.13/asyncio/events.py", line 89, in _run
Jun 16 21:11:55 esel gvfsd[250764]:     self._context.run(self._callback, *self._args)
Jun 16 21:11:55 esel gvfsd[250764]:     ~~~~~~~~~~~~~~~~~^^^^^^^^^^^^^^^^^^^^^^^^^^^^^
Jun 16 21:11:55 esel gvfsd[250764]:   File "/usr/bin/wsdd", line 1562, in handle_change
Jun 16 21:11:55 esel gvfsd[250764]:     self.handle_new_address(address)
Jun 16 21:11:55 esel gvfsd[250764]:     ~~~~~~~~~~~~~~~~~~~~~~~^^^^^^^^^
Jun 16 21:11:55 esel gvfsd[250764]:   File "/usr/bin/wsdd", line 1317, in handle_new_address
Jun 16 21:11:55 esel gvfsd[250764]:     mch = MulticastHandler(address, self.aio_loop)
Jun 16 21:11:55 esel gvfsd[250764]:   File "/usr/bin/wsdd", line 208, in __init__
Jun 16 21:11:55 esel gvfsd[250764]:     self.init_v4()
Jun 16 21:11:55 esel gvfsd[250764]:     ~~~~~~~~~~~~^^
Jun 16 21:11:55 esel gvfsd[250764]:   File "/usr/bin/wsdd", line 275, in init_v4
Jun 16 21:11:55 esel gvfsd[250764]:     self.recv_socket.setsockopt(socket.IPPROTO_IP, socket.IP_ADD_MEMBERSHIP, mreq)
Jun 16 21:11:55 esel gvfsd[250764]:     ~~~~~~~~~~~~~~~~~~~~~~~~~~~^^^^^^^^^^^^^^^^^^^^^^^^^^^^^^^^^^^^^^^^^^^^^^^^^^^
Jun 16 21:11:55 esel gvfsd[250764]: OSError: [Errno 19] No such device
Jun 16 21:11:55 esel gvfsd[250764]: 2025-06-16 21:11:55,035:asyncio ERROR(pid 250764): Exception in callback NetlinkAddressMonitor.handle_change()
Jun 16 21:11:55 esel gvfsd[250764]: handle: <Handle NetlinkAddressMonitor.handle_change()>
Jun 16 21:11:55 esel gvfsd[250764]: Traceback (most recent call last):
Jun 16 21:11:55 esel gvfsd[250764]:   File "/usr/lib64/python3.13/asyncio/events.py", line 89, in _run
Jun 16 21:11:55 esel gvfsd[250764]:     self._context.run(self._callback, *self._args)
Jun 16 21:11:55 esel gvfsd[250764]:     ~~~~~~~~~~~~~~~~~^^^^^^^^^^^^^^^^^^^^^^^^^^^^^
Jun 16 21:11:55 esel gvfsd[250764]:   File "/usr/bin/wsdd", line 1562, in handle_change
Jun 16 21:11:55 esel gvfsd[250764]:     self.handle_new_address(address)
Jun 16 21:11:55 esel gvfsd[250764]:     ~~~~~~~~~~~~~~~~~~~~~~~^^^^^^^^^
Jun 16 21:11:55 esel gvfsd[250764]:   File "/usr/bin/wsdd", line 1317, in handle_new_address
Jun 16 21:11:55 esel gvfsd[250764]:     mch = MulticastHandler(address, self.aio_loop)
Jun 16 21:11:55 esel gvfsd[250764]:   File "/usr/bin/wsdd", line 208, in __init__
Jun 16 21:11:55 esel gvfsd[250764]:     self.init_v4()
Jun 16 21:11:55 esel gvfsd[250764]:     ~~~~~~~~~~~~^^
Jun 16 21:11:55 esel gvfsd[250764]:   File "/usr/bin/wsdd", line 275, in init_v4
Jun 16 21:11:55 esel gvfsd[250764]:     self.recv_socket.setsockopt(socket.IPPROTO_IP, socket.IP_ADD_MEMBERSHIP, mreq)
Jun 16 21:11:55 esel gvfsd[250764]:     ~~~~~~~~~~~~~~~~~~~~~~~~~~~^^^^^^^^^^^^^^^^^^^^^^^^^^^^^^^^^^^^^^^^^^^^^^^^^^^
Jun 16 21:11:55 esel gvfsd[250764]: OSError: [Errno 19] No such device
Jun 16 21:11:55 esel gvfsd[250764]: 2025-06-16 21:11:55,116:wsdd ERROR(pid 250764): error while sending packet on tel0: [Errno 9] Bad file descriptor
Jun 16 21:11:55 esel gvfsd[250764]: 2025-06-16 21:11:55,151:wsdd ERROR(pid 250764): error while sending packet on tel0: [Errno 9] Bad file descriptor
Jun 16 21:11:55 esel gvfsd[250764]: 2025-06-16 21:11:55,264:wsdd ERROR(pid 250764): error while sending packet on tel0: [Errno 9] Bad file descriptor
Jun 16 21:11:55 esel gvfsd[250764]: 2025-06-16 21:11:55,289:wsdd ERROR(pid 250764): error while sending packet on tel0: [Errno 9] Bad file descriptor
Jun 16 21:11:55 esel gvfsd[250764]: 2025-06-16 21:11:55,393:wsdd ERROR(pid 250764): error while sending packet on tel0: [Errno 9] Bad file descriptor
Jun 16 21:11:55 esel gvfsd[250764]: 2025-06-16 21:11:55,633:wsdd ERROR(pid 250764): error while sending packet on tel0: [Errno 9] Bad file descriptor
Jun 16 21:11:55 esel gvfsd[250764]: 2025-06-16 21:11:55,734:wsdd ERROR(pid 250764): error while sending packet on tel0: [Errno 9] Bad file descriptor
```
can you spot something else?

a collegue also confirmed that the traffic manager works with mac os meanwhile :) 


update: more logs.
i thought why not enable debug log of the network manager, maybe it knows what causes the interface to stop

this is really just a glimpse of the full log
```
Jun 16 21:26:53 esel NetworkManager[8336]: <info>  [1750102013.0397] device (tel0): Activation: successful, device activated.
Jun 16 21:26:53 esel NetworkManager[8336]: <debug> [1750102013.0397] device[a5b799e838aeff0c] (tel0): set metered value 4
Jun 16 21:26:53 esel NetworkManager[8336]: <debug> [1750102013.0397] dispatcher: (284) (tel0) dispatching action 'up'
Jun 16 21:26:53 esel NetworkManager[8336]: <trace> [1750102013.0401] pacrunner: call[75]: add config: ({'Interface': <'tel0'>, 'Method': <'direct'>, 'BrowserOnly': <false>},) (pacrunner D-Bus service not running)
Jun 16 21:26:53 esel NetworkManager[8336]: <debug> [1750102013.0401] device[a5b799e838aeff0c] (tel0): connectivity state changed from NONE to LIMITED
Jun 16 21:26:53 esel NetworkManager[8336]: <debug> [1750102013.0401] device[a5b799e838aeff0c] (tel0): connectivity state changed from NONE to LIMITED
Jun 16 21:26:53 esel NetworkManager[8336]: <debug> [1750102013.0401] device[a5b799e838aeff0c] (tel0): remove_pending_action (1): 'in-state-change'
Jun 16 21:26:53 esel NetworkManager[8336]: <debug> [1750102013.0401] device[a5b799e838aeff0c] (tel0): remove_pending_action (0): 'queued-state-change-activated'
Jun 16 21:26:53 esel nm-dispatcher[2077002]: req:2 'up' [tel0]: new request (5 scripts)
Jun 16 21:26:53 esel nm-dispatcher[2077002]: req:2 'up' [tel0]: environment: CONNECTION_DBUS_PATH=/org/freedesktop/NetworkManager/Settings/83
Jun 16 21:26:53 esel nm-dispatcher[2077002]: req:2 'up' [tel0]: environment: CONNECTION_EXTERNAL=1
Jun 16 21:26:53 esel nm-dispatcher[2077002]: req:2 'up' [tel0]: environment: CONNECTION_FILENAME=/run/NetworkManager/system-connections/tel0.nmconnection
Jun 16 21:26:53 esel nm-dispatcher[2077002]: req:2 'up' [tel0]: environment: CONNECTION_UUID=b9b868cb-107e-47a8-a6cc-9763f5e29823
Jun 16 21:26:53 esel nm-dispatcher[2077002]: req:2 'up' [tel0]: environment: CONNECTION_ID=tel0
Jun 16 21:26:53 esel nm-dispatcher[2077002]: req:2 'up' [tel0]: environment: DEVICE_IFACE=tel0
Jun 16 21:26:53 esel nm-dispatcher[2077002]: req:2 'up' [tel0]: environment: DEVICE_IP_IFACE=tel0
Jun 16 21:26:53 esel nm-dispatcher[2077002]: req:2 'up' [tel0]: environment: IP4_NUM_ROUTES=0
Jun 16 21:26:53 esel nm-dispatcher[2077002]: req:2 'up' [tel0]: environment: PATH=/usr/local/sbin:/usr/local/bin:/usr/sbin:/usr/bin
Jun 16 21:26:53 esel nm-dispatcher[2077002]: req:2 'up' [tel0]: environment: NM_DISPATCHER_ACTION=up
Jun 16 21:26:53 esel nm-dispatcher[2077002]: req:2 'up' [tel0]: start running ordered scripts...
Jun 16 21:26:53 esel nm-dispatcher[2077002]: req:2 'up' [tel0], "/usr/lib/NetworkManager/dispatcher.d/04-iscsi": run script
Jun 16 21:26:53 esel NetworkManager[8336]: <trace> [1750102013.0454] settings: [timestamps-keyfile]: write keyfile: "/var/lib/NetworkManager/timestamps"
Jun 16 21:26:53 esel systemd[1]: iscsi.service: Unit cannot be reloaded because it is inactive.
Jun 16 21:26:53 esel nm-dispatcher[2077002]: req:2 'up' [tel0], "/usr/lib/NetworkManager/dispatcher.d/04-iscsi": complete: process succeeded
Jun 16 21:26:53 esel nm-dispatcher[2077002]: req:2 'up' [tel0], "/usr/lib/NetworkManager/dispatcher.d/11-dhclient": run script
Jun 16 21:26:53 esel nm-dispatcher[2077002]: req:2 'up' [tel0], "/usr/lib/NetworkManager/dispatcher.d/11-dhclient": complete: process succeeded
Jun 16 21:26:53 esel nm-dispatcher[2077002]: req:2 'up' [tel0], "/usr/lib/NetworkManager/dispatcher.d/20-chrony-dhcp": run script
Jun 16 21:26:53 esel nm-dispatcher[2077002]: req:2 'up' [tel0], "/usr/lib/NetworkManager/dispatcher.d/20-chrony-dhcp": complete: process succeeded
Jun 16 21:26:53 esel nm-dispatcher[2077002]: req:2 'up' [tel0], "/usr/lib/NetworkManager/dispatcher.d/20-chrony-onoffline": run script
Jun 16 21:26:53 esel nm-dispatcher[2077002]: req:2 'up' [tel0], "/usr/lib/NetworkManager/dispatcher.d/20-chrony-onoffline": complete: process succeeded
Jun 16 21:26:53 esel nm-dispatcher[2077002]: req:2 'up' [tel0], "/usr/lib/NetworkManager/dispatcher.d/99-nvme-nbft-connect.sh": run script
Jun 16 21:26:53 esel nm-dispatcher[2077002]: req:2 'up' [tel0], "/usr/lib/NetworkManager/dispatcher.d/99-nvme-nbft-connect.sh": complete: process succeeded
Jun 16 21:26:53 esel nm-dispatcher[2077002]: req:2 'up' [tel0]: completed (5 scripts)
Jun 16 21:26:53 esel NetworkManager[8336]: <debug> [1750102013.0824] dispatcher: (284) succeeded (after 0.042 sec, 5 scripts invoked)
Jun 16 21:26:53 esel NetworkManager[8336]: <debug> [1750102013.0824] dispatcher: (284) /usr/lib/NetworkManager/dispatcher.d/04-iscsi succeeded
Jun 16 21:26:53 esel NetworkManager[8336]: <debug> [1750102013.0824] dispatcher: (284) /usr/lib/NetworkManager/dispatcher.d/11-dhclient succeeded
Jun 16 21:26:53 esel NetworkManager[8336]: <debug> [1750102013.0824] dispatcher: (284) /usr/lib/NetworkManager/dispatcher.d/20-chrony-dhcp succeeded
Jun 16 21:26:53 esel NetworkManager[8336]: <debug> [1750102013.0824] dispatcher: (284) /usr/lib/NetworkManager/dispatcher.d/20-chrony-onoffline succeeded
Jun 16 21:26:53 esel NetworkManager[8336]: <debug> [1750102013.0824] dispatcher: (284) /usr/lib/NetworkManager/dispatcher.d/99-nvme-nbft-connect.sh succeeded
Jun 16 21:26:56 esel NetworkManager[8336]: <trace> [1750102016.8216] platform-linux: event-notification: RTM_DELADDR, flags 0, seq 24: 72: 10.233.0.0/18
Jun 16 21:26:56 esel NetworkManager[8336]: <debug> [1750102016.8216] platform: (tel0) signal: address 4 removed: 10.233.0.0/18 brd 10.233.63.255 lft forever pref forever lifetime 450651-0[4294967295,4294967295] dev 72 flags permanent src kernel
Jun 16 21:26:56 esel NetworkManager[8336]: <trace> [1750102016.8216] l3cfg[e3eb3ce49cdcd0a2,ifindex=72]: emit signal (platform-change, obj-type=ip4-address, change=removed, obj=10.233.0.0/18 brd 10.233.63.255 lft forever pref forever lifetime 450651-0[4294967295,4294967295] dev 72 flags permanent src kernel)
Jun 16 21:26:56 esel NetworkManager[8336]: <trace> [1750102016.8216] platform-linux: event-notification: RTM_DELROUTE, flags 0, seq 0: type unicast 10.233.0.0/18 dev 72 metric 0 mss 0 rt-src rt-kernel scope link pref-src 10.233.0.0
Jun 16 21:26:56 esel NetworkManager[8336]: <debug> [1750102016.8216] platform: (tel0) signal: route   4 removed: type unicast 10.233.0.0/18 dev 72 metric 0 mss 0 rt-src rt-kernel scope link pref-src 10.233.0.0
Jun 16 21:26:56 esel NetworkManager[8336]: <trace> [1750102016.8217] l3cfg[e3eb3ce49cdcd0a2,ifindex=72]: emit signal (platform-change, obj-type=ip4-route, change=removed, obj=type unicast 10.233.0.0/18 dev 72 metric 0 mss 0 rt-src rt-kernel scope link pref-src 10.233.0.0)
Jun 16 21:26:56 esel NetworkManager[8336]: <trace> [1750102016.8217] platform-linux: event-notification: RTM_DELROUTE, flags 0, seq 0: ignore
```


from my point of view it looks like we are not able to spot the reason here
```
Jun 16 21:26:53 esel NetworkManager[8336]: <debug> [1750102013.0824] dispatcher: (284) /usr/lib/NetworkManager/dispatcher.d/99-nvme-nbft-connect.sh succeeded
Jun 16 21:26:56 esel NetworkManager[8336]: <trace> [1750102016.8216] platform-linux: event-notification: RTM_DELADDR, flags 0, seq 24: 72: 10.233.0.0/18
```
:/

**Comment by thallgren** [comment]
Sorry no, I have no idea at the moment. I'm using Fedora 42 without any issues. In fact, the output from `journalctl -f` is more or less identical to yours up to the point where the tel0 device becomes unmanaged. I don't see this one until I do `telepresence quit`:

```
Jun 16 21:11:54 esel NetworkManager[8336]: <info>  [1750101114.9130] device (tel0): state change: activated -> unmanaged (reason 'unmanaged', managed-type: 'removed')
```

**Comment by thallgren** [comment]
I also discovered that I actually have the avahi-daemon active. Didn't catch that earlier, sorry.

**Comment by Loki-Afro** [comment]
thanks for testing fedora 42 as well, i'll try a minimal installation today in a vm, lets see, if not i got another fedora 42 laptop to play with ... 

i could also debug the telepresence client side i guess - anywhere particular i should look out for?

**Comment by Loki-Afro** [comment]
@thallgren progress has been made

i isolated the issue further, spun up a few more vms  (all linux) on the same host - same issue.
just now i switched from my local network to a mobile one - and it just works.

in my local network there is a dns as well, probably in that windows vm it simply ignored it where in linux it was correctly propagated, thats not the final cause yet, but a very good indicator i think!

**Comment by thallgren** [comment]
Yeah, issues like this causes some detective work for sure. I'm very interested in any further findings that you make, and if there are things to improve in Telepresence.

**Comment by Loki-Afro** [comment]
@thallgren further isolated the issue
its not related to my local dns, but still my local network.
i put a breakpoint at https://github.com/telepresenceio/telepresence/blob/734316bc499689fbf8d5b057638db5ae7da28404/pkg/vif/router.go#L234 in the root daemon. resulting in the tun device being established, routes being pushed and i think one should be ready to go

i let ai write some hacky test
```
package main

import (
	"context"
	"fmt"
	"github.com/datawire/dlib/dlog"
	"github.com/datawire/dlib/dtime"
	"google.golang.org/grpc/codes"
	"google.golang.org/grpc/status"
	"os"
	"time"

	"google.golang.org/grpc"
	"google.golang.org/grpc/credentials/insecure"
	"google.golang.org/protobuf/types/known/emptypb"

	rpc "github.com/telepresenceio/telepresence/rpc/v2/manager"
)

func main() {
	ctx, cancel := context.WithTimeout(context.Background(), 10*time.Second)
	defer cancel()

	// Connect to the server
	//conn, err := grpc.DialContext(ctx, "localhost:8081",
	conn, err := grpc.DialContext(ctx, "10.213.51.9:8081",
		grpc.WithTransportCredentials(insecure.NewCredentials()),
		grpc.WithBlock())
	if err != nil {
		fmt.Printf("Failed to connect: %v\n", err)
		os.Exit(1)
	}
	defer conn.Close()

	fmt.Println("✅ gRPC connection established successfully!")

	// Create a client
	client := rpc.NewManagerClient(conn)

	// Try the Version method
	version, err := client.Version(ctx, &emptypb.Empty{})
	if err != nil {
		fmt.Printf("❌ Version call failed: %v\n", err)
	} else {
		fmt.Printf("✅ Version call succeeded! Version: %s\n", version.Version)
	}

	// Try the GetClientConfig method
	clientConfig, err := client.GetClientConfig(ctx, &emptypb.Empty{})
	if err != nil {
		fmt.Printf("❌ GetClientConfig call failed: %v\n", err)
	} else {
		fmt.Println("✅ GetClientConfig call succeeded!")
		fmt.Println(clientConfig)
		//fmt.Printf("   - DNS Serving: %t\n", clientConfig.DnsServing)
		//fmt.Printf("   - Routing Serving: %t\n", clientConfig.RoutingServing)
	}

	watchClusterInfo(ctx, client)

	fmt.Println("\nTest complete")
}

func watchClusterInfo(ctx context.Context, managerClient rpc.ManagerClient) error {
	backoff := 100 * time.Millisecond

	for ctx.Err() == nil {
		infoStream, err := managerClient.WatchClusterInfo(ctx, nil)
		if err != nil {
			err = fmt.Errorf("error when calling WatchClusterInfo: %w", err)
			dlog.Warn(ctx, err)
			return err
		}

		for ctx.Err() == nil {
			mgrInfo, err := infoStream.Recv()
			if err != nil {
				if gErr, ok := status.FromError(err); ok {
					switch gErr.Code() {
					case codes.Canceled:
						// The connector, which is routing this connection, cancelled it, which means that the client
						// session is dead.
						return nil
					case codes.Unavailable:
						// Abrupt shutdown. This is nothing that the session should survive
						dlog.Errorf(ctx, "WatchClusterInfo recv: Unavailable: %v", gErr.Message())
					}
				} else {
					dlog.Errorf(ctx, "WatchClusterInfo recv: %v", err)
				}
				break
			}
			dlog.Infoln(ctx, "waiting?", mgrInfo)
		}
		dtime.SleepWithContext(ctx, backoff)
		backoff *= 2
		if backoff > 15*time.Second {
			backoff = 15 * time.Second
		}
	}
	return nil
}

```

however it fails with `Failed to connect: context deadline exceeded` when the tun device is established.
you may also spot that localhost:8181 line, the test suceedes if i do a simple kubectl port-forward to the traffic-manager

i also ran a tcpdump for that tun interface and then called that test
```
tcpdump -i tel1 host 10.213.51.9
dropped privs to tcpdump
tcpdump: verbose output suppressed, use -v[v]... for full protocol decode
listening on tel1, link-type RAW (Raw IP), snapshot length 262144 bytes
16:49:07.466423 IP esel.47568 > 10.213.51.9.tproxy: Flags [S], seq 3329914572, win 64240, options [mss 1460,sackOK,TS val 2490418703 ecr 0,nop,wscale 7], length 0
16:49:07.780790 IP esel.42932 > 10.213.51.9.llmnr: Flags [S], seq 1743746862, win 64240, options [mss 1460,sackOK,TS val 2490419017 ecr 0,nop,wscale 7,exp-tfo cookiereq], length 0
16:49:08.494100 IP esel.47568 > 10.213.51.9.tproxy: Flags [S], seq 3329914572, win 64240, options [mss 1460,sackOK,TS val 2490419731 ecr 0,nop,wscale 7], length 0
16:49:08.813135 IP esel.42932 > 10.213.51.9.llmnr: Flags [S], seq 1743746862, win 64240, options [mss 1460,sackOK,TS val 2490420050 ecr 0,nop,wscale 7], length 0
16:49:09.517115 IP esel.47568 > 10.213.51.9.tproxy: Flags [S], seq 3329914572, win 64240, options [mss 1460,sackOK,TS val 2490420754 ecr 0,nop,wscale 7], length 0
16:49:10.542140 IP esel.47568 > 10.213.51.9.tproxy: Flags [S], seq 3329914572, win 64240, options [mss 1460,sackOK,TS val 2490421779 ecr 0,nop,wscale 7], length 0
16:49:11.565164 IP esel.47568 > 10.213.51.9.tproxy: Flags [S], seq 3329914572, win 64240, options [mss 1460,sackOK,TS val 2490422802 ecr 0,nop,wscale 7], length 0
16:49:12.590144 IP esel.47568 > 10.213.51.9.tproxy: Flags [S], seq 3329914572, win 64240, options [mss 1460,sackOK,TS val 2490423827 ecr 0,nop,wscale 7], length 0
16:49:14.637121 IP esel.47568 > 10.213.51.9.tproxy: Flags [S], seq 3329914572, win 64240, options [mss 1460,sackOK,TS val 2490425874 ecr 0,nop,wscale 7], length 0
```

there are no responses or anything from the server side

similar with curl
```
zarathustra@esel ~ % curl -v 10.213.51.9:8081 --connect-timeout 5
*   Trying 10.213.51.9:8081...
* Connection timed out after 5002 milliseconds
* closing connection #0
curl: (28) Connection timed out after 5002 milliseconds
```

i'm not so confident when it comes to networking ... but that confirms the routes are pushed correcty and also setup correctly?

**Comment by thallgren** [comment]
If the gRPC connection to the traffic-manager fails when the TUN-device is created, then that's probably due that the Kubernetes API is made available on the same subnet.

What URL is the Kubernetes API using? What's the output of `kubectl config view -o jsonpath='{.clusters[*].cluster.server}'`?

**Comment by Loki-Afro** [comment]
hi @thallgren 
```
telepresence with breakpoint after tun interface setup
root@esel /home/zarathustra # ip route show
default via 192.168.1.1 dev wlp0s20f3 proto dhcp src 192.168.1.102 metric 600
10.209.0.0/16 dev tel0 proto kernel scope link src 10.209.0.0
10.210.177.0/24 dev tel0 proto kernel scope link src 10.210.177.0
10.211.74.0/24 dev tel0 proto kernel scope link src 10.211.74.0
10.213.0.0/16 dev tel0 proto kernel scope link src 10.213.0.0
10.217.252.0/23 dev tel0 proto kernel scope link src 10.217.252.0
10.219.0.0/17 dev tel0 proto kernel scope link src 10.219.0.0
10.220.96.0/19 dev tel0 proto kernel scope link src 10.220.96.0
10.221.164.0/24 dev tel0 proto kernel scope link src 10.221.164.0
10.233.0.0/18 dev tel0 proto kernel scope link src 10.233.0.0
85.215.128.0/17 dev tel0 proto kernel scope link src 85.215.128.0
192.168.1.0/24 dev wlp0s20f3 proto kernel scope link src 192.168.1.102 metric 600
```

```
kubectl config view -o jsonpath='{.clusters[*].cluster.server}
https://cp-<redacted>.cluster.ionos.com:11382
```
this one is publicly accessible, maybe its relevant, i did not modify client.dns.excludedSuffixes in the traffic manager, so it includes `.com`

that domain has multiple ips 
217.160.*.*, 185.132.*.*, 195.20.*.*

i don't see a clash here with the routes here.
also from within the cluster you can not connect to that domain, you get a connection timeout with curl
```
curl --insecure https://cp-<redacted>.cluster.ionos.com:1138 --connect-timeout 5
curl: (28) Connection timed out after 5002 milliseconds
```

**Comment by thallgren** [comment]
What's the IP address of `cp-<redacted>.cluster.ionos.com`? Is that IP address included in any of the addresses that the Telepresence TUN device is using?

**Comment by thallgren** [comment]
I think you're using an incorrect port number when you try `curl --insecure https://cp-<redacted>.cluster.ionos.com:1138 --connect-timeout 5`. It's 11382, not 1138.

**Comment by Loki-Afro** [comment]
@thallgren true, i missed the trailing 2
```
#dev pod within cluster
[noname@pwi-infra-tools /]# curl -v  --insecure https://cp-1692764921.cluster.ionos.com:11382 --connect-timeout 5
* Host cp-1692764921.cluster.ionos.com:11382 was resolved.
* IPv6: (none)
* IPv4: 217.160.201.201, 217.160.201.197, 217.160.201.144, 217.160.154.104, 185.132.47.174, 217.160.201.77, 185.132.45.185, 195.20.227.74, 217.160.201.183
.
.
.
{
  "kind": "Status",
  "apiVersion": "v1",
  "metadata": {},
  "status": "Failure",
  "message": "forbidden: User \"system:anonymous\" cannot get path \"/\"",
  "reason": "Forbidden",
  "details": {},
  "code": 403
}
```

these ips, are the same from within the cluster as from extern

i do not see them popping up in the tun interface

**Comment by thallgren** [comment]
Just to verify that I've understand things correctly:

1. You can run `curl -v  --insecure https://cp-1692764921.cluster.ionos.com:11382 --connect-timeout 5` successfully _both from within the cluster and from your workstation_ (success == you get a 403 error).
2. After you do `telepresence connect` and the TUN device is created, you are no longer able to do this from your workstation (curl times out).

Is this correct?

**Comment by Loki-Afro** [comment]
1.
within cluster works fine
from my workstation works fine

2. no, from my workstation when tun interface is setup works fine

what does not work when tun interface is setup:
```
kubectl cluster-info
E0619 17:20:34.530536  661109 memcache.go:265] couldn't get current server API group list: Get "https://cp-1692764921.cluster.ionos.com:11382/api?timeout=32s": proxyconnect tcp: dial tcp 85.215.190.156:443: i/o timeout
```

where `85.215.190.156` is the ip of a `proxy-url` defined in the kubeconfig
could that be the actual issue? and if so - what to do?


and again, when switching to mobile network, **everything** just works

**Comment by thallgren** [comment]
Yes, that's the problem! One of the pod-subnets that the TUN-device adds is `85.215.128.0/17`.  That range covers the `85.215.190.156` IP. So in essence, you're asking Telepresence to map a pod-subnet that routes your proxy. It's somewhat weird that this pod-subnet starts with `85.` when all others start with `10.`.

**Comment by Loki-Afro** [comment]
@thallgren okay that did it!
in the client config
```
routing:
  neverProxySubnets:
    - 85.215.128.0/17
```

finally i can recommend telepresence with the teams  with a clear conscience!

thanks a lot for your patience @thallgren
